{
  "package": "Package F — Candidate Source Verification + Human Review",
  "package_version": "0.1.0",
  "schema_version": "1.0.0",
  "created_at": "2026-08-30",
  "baseline_batch": "data/candidates/package-e-batch-001.v0.2.json",
  "baseline_record_count": 19,
  "scope_rule": "Only the 19 Package E candidates are in scope. No candidate expansion and no Experiment 003 work is permitted.",
  "workflow": {
    "review_states": [
      "candidate",
      "reviewed",
      "rejected",
      "needs_evidence"
    ],
    "transitions": {
      "candidate": [
        "reviewed",
        "rejected",
        "needs_evidence"
      ],
      "needs_evidence": [
        "candidate",
        "rejected"
      ]
    },
    "publication_state": "published",
    "publication_is_separate_gate": true,
    "promotion_rule": "A documented human reviewer must complete the checklist and sign a decision. This generated verification package does not promote any record to Reviewed or Published."
  },
  "evidence_track_definitions": {
    "linguistic_etymological": "Lexical, grammatical, historical-linguistic, borrowing, or cognacy evidence. Ordinary translation support must be distinguished from etymology.",
    "phonetic": "Pronunciation, phonological form, regular sound correspondence, or measured phonetic comparison.",
    "semantic_cognitive": "Sense structure, conceptual metaphor, spatial schema, psycholinguistic, or cognitive evidence.",
    "speculative_association": "Exploratory analogy, sound symbolism, literary association, or untested cross-language proposal."
  },
  "status_summary": {
    "candidate": 10,
    "reviewed": 0,
    "rejected": 0,
    "needs_evidence": 9,
    "published": 0
  },
  "records": [
    {
      "candidate_id": "CAND-en-time-001",
      "source_word": "time",
      "normalized_form": "time",
      "baseline_record": {
        "lexical_meaning": {
          "en": "Temporal duration, sequence or a located moment.",
          "zh-Hans": "时间的持续、顺序或某一时刻。"
        },
        "candidate_mapping": "时间 · temps",
        "source_provenance": "AGENTS.md",
        "blockers": [
          "authoritative English–Chinese–French lexical sources",
          "dedicated Language Book review"
        ]
      },
      "scoped_analysis": {
        "part_of_speech": "noun",
        "selected_sense": "temporal duration, sequence, or a point in time",
        "reviewed_candidate_mapping": "时间 · temps",
        "mapping_type": "lexical-equivalent-candidate",
        "claim_boundary": "A cross-language lexical candidate for the selected sense only; not evidence of shared etymology or universal semantic identity."
      },
      "source_verification": [
        {
          "verification_id": "CAND-en-time-001-SRC-PROJECT",
          "source_type": "project-primary-source",
          "title": "Unilanguage project source: AGENTS.md",
          "locator": "AGENTS.md",
          "url": "AGENTS.md",
          "specific_location": "document-level occurrence",
          "accessed_at": "2026-08-30",
          "version_info": "Package E baseline commit 1a06dfd",
          "verifiable_content": "The project source contains the concept or protocol role from which Package E extracted this candidate.",
          "supports": [
            "candidate inclusion in this fixed 19-record review queue",
            "project-internal semantic context"
          ],
          "does_not_support": [
            "external lexical equivalence",
            "shared etymology",
            "phonetic correspondence",
            "publication readiness"
          ]
        },
        {
          "verification_id": "CAND-en-time-001-SRC-CAM-ZH",
          "source_type": "authoritative-bilingual-dictionary",
          "title": "Cambridge Dictionary: time — English–Mandarin Chinese",
          "locator": "headword “time”; reviewer-selected sense: temporal duration, sequence, or a point in time",
          "url": "https://dictionary.cambridge.org/dictionary/english-chinese-simplified/time",
          "specific_location": "headword, part-of-speech label, sense divisions, translations, and examples",
          "accessed_at": "2026-08-30",
          "version_info": "live web edition; no stable release number displayed",
          "verifiable_content": "The page permits verification of the noun headword, sense boundaries, and candidate Mandarin Chinese rendering “时间”.",
          "supports": [
            "ordinary lexical comparison for the selected sense",
            "Mandarin Chinese candidate form(s): 时间"
          ],
          "does_not_support": [
            "The page does not establish unrestricted equivalence across every sense of “time”.",
            "common origin, borrowing, or regular sound correspondence",
            "the Unilanguage protocol mapping level"
          ]
        },
        {
          "verification_id": "CAND-en-time-001-SRC-CAM-FR",
          "source_type": "authoritative-bilingual-dictionary",
          "title": "Cambridge Dictionary: time — English–French",
          "locator": "headword “time”; reviewer-selected sense: temporal duration, sequence, or a point in time",
          "url": "https://dictionary.cambridge.org/dictionary/english-french/time",
          "specific_location": "headword, part-of-speech label, sense divisions, translations, and examples",
          "accessed_at": "2026-08-30",
          "version_info": "live web edition; no stable release number displayed",
          "verifiable_content": "The page permits verification of the noun headword, sense boundaries, and candidate French rendering “temps”.",
          "supports": [
            "ordinary lexical comparison for the selected sense",
            "French candidate form(s): temps"
          ],
          "does_not_support": [
            "The page does not establish unrestricted equivalence across every sense of “time”.",
            "common origin, borrowing, or regular sound correspondence",
            "the Unilanguage protocol mapping level"
          ]
        }
      ],
      "evidence_tracks": {
        "linguistic_etymological": {
          "status": "supported",
          "supports": "Bilingual dictionary evidence supports at least part of the selected lexical comparison.",
          "limits": "Lexical equivalence is not cognacy. No historical transmission chain or comparative-etymological evidence was found or claimed."
        },
        "phonetic": {
          "status": "not_assessed",
          "supports": "No phonetic evidence is used for this candidate.",
          "limits": "Surface resemblance, if any, must not affect review status without a separately documented phonetic analysis."
        },
        "semantic_cognitive": {
          "status": "not_assessed",
          "supports": "No independent cognitive evidence is recorded.",
          "limits": "Project framework text is not independent empirical cognitive evidence."
        },
        "speculative_association": {
          "status": "not_supported",
          "supports": "No speculative association is required for the ordinary lexical comparison.",
          "limits": "Any broader sound-symbolic, universal, metaphorical, or shared-origin claim remains unsupported."
        }
      },
      "provisional_assessment": {
        "review_status": "candidate",
        "confidence": "high",
        "mapping_level": "A",
        "level_is_provisional": true,
        "reason": "The selected ordinary temporal sense is directly represented, but time is highly polysemous.",
        "publication_status": "not_published",
        "automatic_publication_allowed": false
      },
      "counterexamples_uncertainties_conflicts": [
        "The selected ordinary temporal sense is directly represented, but time is highly polysemous.",
        "Translations vary by part of speech, collocation, register, and context; the listed forms are not interchangeable in every sentence.",
        "No cited source supports a common etymology or general phonetic law across English, Chinese, and French."
      ],
      "human_review": {
        "reviewer": null,
        "reviewed_at": null,
        "decision": null,
        "rationale": null,
        "checklist": [
          {
            "item": "Confirm all three source locators open and match the recorded headword/sense.",
            "complete": false
          },
          {
            "item": "Confirm part of speech and split the record if forms cross grammatical categories.",
            "complete": false
          },
          {
            "item": "Confirm Chinese and French forms with context-sensitive examples.",
            "complete": false
          },
          {
            "item": "Review counterexamples, uncertainty, and conflicting evidence without deleting them.",
            "complete": false
          },
          {
            "item": "Confirm the evidence-track labels and non-cognacy boundary.",
            "complete": false
          },
          {
            "item": "Record a signed decision: reviewed, rejected, or needs_evidence.",
            "complete": false
          }
        ],
        "allowed_decisions": [
          "reviewed",
          "rejected",
          "needs_evidence"
        ],
        "publish_requires_separate_gate": true
      }
    },
    {
      "candidate_id": "CAND-en-space-001",
      "source_word": "space",
      "normalized_form": "space",
      "baseline_record": {
        "lexical_meaning": {
          "en": "Physical or conceptual extension in which position and relation can be described.",
          "zh-Hans": "可描述位置与关系的物理或概念延展。"
        },
        "candidate_mapping": "空间 · espace",
        "source_provenance": "protocol/protocol.space.html#definition",
        "blockers": [
          "external lexical citations",
          "mapping-level review"
        ]
      },
      "scoped_analysis": {
        "part_of_speech": "noun",